{
  "schema_version": "1.0.0",
  "suite_id": "SYNTHETIC-WORKFLOW-V1",
  "suite_version": "1.0.0",
  "frozen": true,
  "purpose": "Validate TheCubedz workflow controls; this suite is not evidence for a physical geometry.",
  "cases": [
    {
      "case_id": "SYN-001",
      "block": "SCHEMA_REPRESENTATION",
      "title": "Canonical Candidate 000001",
      "expected": "ACCEPT",
      "probe": "candidate:canonical"
    },
    {
      "case_id": "SYN-002",
      "block": "SCHEMA_REPRESENTATION",
      "title": "JSON object keys reordered",
      "expected": "ACCEPT",
      "probe": "candidate:canonical"
    },
    {
      "case_id": "SYN-003",
      "block": "SCHEMA_REPRESENTATION",
      "title": "Insignificant whitespace changed",
      "expected": "ACCEPT",
      "probe": "candidate:canonical"
    },
    {
      "case_id": "SYN-004",
      "block": "SCHEMA_REPRESENTATION",
      "title": "Equivalent rational sign representation",
      "expected": "ACCEPT",
      "probe": "candidate:canonical"
    },
    {
      "case_id": "SYN-005",
      "block": "SCHEMA_REPRESENTATION",
      "title": "Explicit positive numeric signs",
      "expected": "ACCEPT",
      "probe": "candidate:canonical"
    },
    {
      "case_id": "SYN-006",
      "block": "SCHEMA_REPRESENTATION",
      "title": "Unknown top-level field",
      "expected": "REJECT",
      "probe": "candidate:unknown_field"
    },
    {
      "case_id": "SYN-007",
      "block": "SCHEMA_REPRESENTATION",
      "title": "Missing candidate identifier",
      "expected": "REJECT",
      "probe": "candidate:missing_id"
    },
    {
      "case_id": "SYN-008",
      "block": "SCHEMA_REPRESENTATION",
      "title": "Invalid candidate identifier format",
      "expected": "REJECT",
      "probe": "candidate:bad_id"
    },
    {
      "case_id": "SYN-009",
      "block": "SCHEMA_REPRESENTATION",
      "title": "Unsupported schema version",
      "expected": "REJECT",
      "probe": "candidate:bad_schema_version"
    },
    {
      "case_id": "SYN-010",
      "block": "SCHEMA_REPRESENTATION",
      "title": "Missing coordinate declaration",
      "expected": "REJECT",
      "probe": "candidate:missing_coordinates"
    },
    {
      "case_id": "SYN-011",
      "block": "SCHEMA_REPRESENTATION",
      "title": "Duplicate coordinate name",
      "expected": "REJECT",
      "probe": "candidate:duplicate_coordinates"
    },
    {
      "case_id": "SYN-012",
      "block": "SCHEMA_REPRESENTATION",
      "title": "Wrong coordinate count",
      "expected": "REJECT",
      "probe": "candidate:three_coordinates"
    },
    {
      "case_id": "SYN-013",
      "block": "SCHEMA_REPRESENTATION",
      "title": "Missing metric tensor",
      "expected": "REJECT",
      "probe": "candidate:missing_metric"
    },
    {
      "case_id": "SYN-014",
      "block": "SCHEMA_REPRESENTATION",
      "title": "Metric has three rows",
      "expected": "REJECT",
      "probe": "candidate:three_rows"
    },
    {
      "case_id": "SYN-015",
      "block": "SCHEMA_REPRESENTATION",
      "title": "Metric has five rows",
      "expected": "REJECT",
      "probe": "candidate:five_rows"
    },
    {
      "case_id": "SYN-016",
      "block": "SCHEMA_REPRESENTATION",
      "title": "Ragged metric row",
      "expected": "REJECT",
      "probe": "candidate:ragged_row"
    },
    {
      "case_id": "SYN-017",
      "block": "SCHEMA_REPRESENTATION",
      "title": "Non-numeric metric entry",
      "expected": "REJECT",
      "probe": "candidate:nonnumeric_entry"
    },
    {
      "case_id": "SYN-018",
      "block": "SCHEMA_REPRESENTATION",
      "title": "Non-finite metric entry",
      "expected": "REJECT",
      "probe": "candidate:nonfinite_entry"
    },
    {
      "case_id": "SYN-019",
      "block": "SCHEMA_REPRESENTATION",
      "title": "Boolean where a number is required",
      "expected": "REJECT",
      "probe": "candidate:boolean_entry"
    },
    {
      "case_id": "SYN-020",
      "block": "SCHEMA_REPRESENTATION",
      "title": "Empty assumptions disclosure",
      "expected": "REJECT",
      "probe": "candidate:empty_assumptions"
    },
    {
      "case_id": "SYN-021",
      "block": "SCHEMA_REPRESENTATION",
      "title": "Unknown validation profile",
      "expected": "REJECT",
      "probe": "candidate:unknown_profile"
    },
    {
      "case_id": "SYN-022",
      "block": "SCHEMA_REPRESENTATION",
      "title": "Invalid status vocabulary",
      "expected": "REJECT",
      "probe": "candidate:bad_status"
    },
    {
      "case_id": "SYN-023",
      "block": "SCHEMA_REPRESENTATION",
      "title": "Duplicate JSON key during ingestion",
      "expected": "REJECT",
      "probe": "candidate:duplicate_key"
    },
    {
      "case_id": "SYN-024",
      "block": "SCHEMA_REPRESENTATION",
      "title": "UTF-8 explanatory metadata",
      "expected": "ACCEPT",
      "probe": "candidate:utf8_metadata"
    },
    {
      "case_id": "SYN-025",
      "block": "SCHEMA_REPRESENTATION",
      "title": "Executable content embedded as candidate field",
      "expected": "REJECT",
      "probe": "candidate:executable_field"
    },
    {
      "case_id": "SYN-026",
      "block": "ALGEBRA_CONVENTIONS",
      "title": "Canonical signature -+++",
      "expected": "ACCEPT",
      "probe": "science:canonical"
    },
    {
      "case_id": "SYN-027",
      "block": "ALGEBRA_CONVENTIONS",
      "title": "Opposite signature profile not implemented",
      "expected": "UNRESOLVED",
      "probe": "scope:opposite_signature_profile"
    },
    {
      "case_id": "SYN-028",
      "block": "ALGEBRA_CONVENTIONS",
      "title": "Declared signature disagrees with metric",
      "expected": "REJECT",
      "probe": "science:signature_mismatch"
    },
    {
      "case_id": "SYN-029",
      "block": "ALGEBRA_CONVENTIONS",
      "title": "Symmetric off-diagonal profile not implemented",
      "expected": "UNRESOLVED",
      "probe": "scope:off_diagonal_profile"
    },
    {
      "case_id": "SYN-030",
      "block": "ALGEBRA_CONVENTIONS",
      "title": "Unmatched off-diagonal entry",
      "expected": "REJECT",
      "probe": "science:nonsymmetric"
    },
    {
      "case_id": "SYN-031",
      "block": "ALGEBRA_CONVENTIONS",
      "title": "Euclidean non-spacetime profile",
      "expected": "UNRESOLVED",
      "probe": "scope:euclidean_profile"
    },
    {
      "case_id": "SYN-032",
      "block": "ALGEBRA_CONVENTIONS",
      "title": "Correct Minkowski inverse",
      "expected": "ACCEPT",
      "probe": "science:canonical"
    },
    {
      "case_id": "SYN-033",
      "block": "ALGEBRA_CONVENTIONS",
      "title": "Incorrect expected inverse",
      "expected": "REJECT",
      "probe": "science:inverse_mismatch"
    },
    {
      "case_id": "SYN-034",
      "block": "ALGEBRA_CONVENTIONS",
      "title": "Matrix product differs from identity",
      "expected": "REJECT",
      "probe": "science:inverse_mismatch"
    },
    {
      "case_id": "SYN-035",
      "block": "ALGEBRA_CONVENTIONS",
      "title": "Determinant exactly -1",
      "expected": "ACCEPT",
      "probe": "science:canonical"
    },
    {
      "case_id": "SYN-036",
      "block": "ALGEBRA_CONVENTIONS",
      "title": "Incorrect determinant expectation",
      "expected": "REJECT",
      "probe": "science:determinant_mismatch"
    },
    {
      "case_id": "SYN-037",
      "block": "ALGEBRA_CONVENTIONS",
      "title": "Singular metric",
      "expected": "REJECT",
      "probe": "science:singular"
    },
    {
      "case_id": "SYN-038",
      "block": "ALGEBRA_CONVENTIONS",
      "title": "Two timelike directions",
      "expected": "UNRESOLVED",
      "probe": "scope:unsupported_signature"
    },
    {
      "case_id": "SYN-039",
      "block": "ALGEBRA_CONVENTIONS",
      "title": "No timelike direction",
      "expected": "UNRESOLVED",
      "probe": "scope:unsupported_signature"
    },
    {
      "case_id": "SYN-040",
      "block": "ALGEBRA_CONVENTIONS",
      "title": "Consistent coordinate transformation",
      "expected": "UNRESOLVED",
      "probe": "scope:coordinate_transform"
    },
    {
      "case_id": "SYN-041",
      "block": "ALGEBRA_CONVENTIONS",
      "title": "Coordinate labels permuted without transformation",
      "expected": "REJECT",
      "probe": "science:coordinate_mismatch"
    },
    {
      "case_id": "SYN-042",
      "block": "ALGEBRA_CONVENTIONS",
      "title": "Dimensionless units with dimensional parameters",
      "expected": "REJECT",
      "probe": "science:unit_mismatch"
    },
    {
      "case_id": "SYN-043",
      "block": "ALGEBRA_CONVENTIONS",
      "title": "Declared natural units",
      "expected": "ACCEPT",
      "probe": "science:canonical"
    },
    {
      "case_id": "SYN-044",
      "block": "ALGEBRA_CONVENTIONS",
      "title": "Mixed incompatible units",
      "expected": "REJECT",
      "probe": "science:unit_mismatch"
    },
    {
      "case_id": "SYN-045",
      "block": "ALGEBRA_CONVENTIONS",
      "title": "Declared domain boundary",
      "expected": "UNRESOLVED",
      "probe": "scope:domain_model"
    },
    {
      "case_id": "SYN-046",
      "block": "ALGEBRA_CONVENTIONS",
      "title": "Evaluation outside declared domain",
      "expected": "REJECT",
      "probe": "policy:outside_domain"
    },
    {
      "case_id": "SYN-047",
      "block": "ALGEBRA_CONVENTIONS",
      "title": "Flatness implication for exact constant baseline",
      "expected": "ACCEPT",
      "probe": "science:canonical"
    },
    {
      "case_id": "SYN-048",
      "block": "ALGEBRA_CONVENTIONS",
      "title": "General flatness claim outside profile",
      "expected": "UNRESOLVED",
      "probe": "scope:general_flatness"
    },
    {
      "case_id": "SYN-049",
      "block": "ALGEBRA_CONVENTIONS",
      "title": "Mathematical pass used to claim stability",
      "expected": "UNRESOLVED",
      "probe": "scope:stability"
    },
    {
      "case_id": "SYN-050",